Name,Category,Organization,Date,End Date,Time,Location,Description,URL,Emily: 👍
"Sam Abrams, Education and the Commercial Mindset","English, History, Global Studies, School Design, Humanities, Journalism",Odyssey Bookshop,"Wed, Apr 12, 2017",,7:00 PM,Odyssey Bookshop,"Drawing on his book, Education and the Commercial Mindset, Sam Abrams, a Holyoke native, will discuss the divergent paths taken by education policymakers in Chile, Finland, Sweden, and the United States. In addition, Abrams will address the implications of Donald Trump’s presidency for schooling in the United States. Writing in The New York Review of Books, Diane Ravitch described Education and the Commercial Mindset as “an elegant analysis of the workings of market forces in education.” Reviewing the book for Teachers College Record, Margaret Stange-Topkins described it as “exceptionally balanced, meticulously researched, and rooted in a deep understanding of the historical, cultural, and social antecedents of the widespread use of business practices and norms in education.” Sam Abrams is the director of the National Center for the Study of Privatization in Education at Teachers College, Columbia University. Dedicated to fitness as well as scholarship, Abrams is a veteran coach in the Ice Hockey in Harlem program in New York’s Central Park. He is the son of long-time area residents Robert and Frances Abrams.",http://www.odysseybks.com/event/sam-abrams-education-and-commercial-mindset,
"85th Five College Chemistry Lecture Series: THE ORIGINS AND DEVELOPMENT OF ICP-MASS SPECTROMETRY: A 20 YEAR RESEARCH PROJECT IN INSTRUMENTATION, Prof. Sam Houk",Science,Hampshire College,"Wed, Apr 12, 2017",,4:30pm-5:30pm,"Hampshire College, Amherst, MA","85th Five College Chemistry Lecture Series Event:
THE ORIGINS AND DEVELOPMENT OF ICP-MASS SPECTROMETRY: A 20 YEAR RESEARCH PROJECT IN INSTRUMENTATION, Prof. Sam Houk
Dept. of Chemistry and Ames Laboratory, Iowa State University, Ames, IA",https://intranet.hampshire.edu/calendar/thyme/index.php?event_action=view&eid=123876&instance=2017-4-12,
Rosa Alice Branco Public Reading,"Arts, English",Smith College Poetry Center,"Thu, Apr 13, 2017",,4:30-7:30pm,"Smith College, Northampton, MA","A reading and discussion with Rosa Alice Branco, a Portugueses poet and translator Alexis Levitin. There will be a bilingual reading followed by a discussion of the collaborative translation process.
Rosa Alice branco is a poet, essayist, and translator with a Ph.D. in Philosophy. She has published eleven volumes of poetry. Her work has been anthologized in numerous countries, including Russia, Latvia, Hungary, Macedonia, Germany, and the United States. Her work has appeared in this country in over forty literary magazines. 
Alexis Levitin translates works from Portugal, Brazil, and Ecuador. He has translated over forty books.",https://www.smith.edu/about-smith/new-calendar?trumbaEmbed=view%3Devent%26eventid%3D214179421,
Housing and Climate Adaptation,"Architecture, Sustainability",Umass Amherst,"Thu, Apr 13, 2017",,,"Umass Amherst, Amherst, MA","""Housing and Climate Adaptation""
Victoria Basolo Professor, Urban Planning and Public Policy, UC Irvine

The Zube lecture series is named for Ervin Zube, former head of LARP from 1974 to 1980. Professor Zube is internationally known for his leadership in developing a culture of academic research in the profession of landscape architecture. His research made numerous seminal contributions to landscape planning theory and practice. Ervin left UMass for the University of Arizona, where he continued his renowned research and teaching until he passed away in 2001.

Ervin and his wife Margaret endowed at UMass in 2004 to “bring scholars to the department to stimulate and enrich our academic community in landscape architecture and planning."" The Zube endowment has been supported generously by alumni, students and faculty.

We honor their leadership and generosity through the lecture series which continues to enrich our community with the thoughts and works of local, national and international academic and professional leaders.",https://www.umass.edu/larp/zube-lecture-series,
Architecture Concepts,Architecture,Umass Amherst,"Thu, Apr 13, 2017",,6:00 PM,"Umass Amherst, Amherst, MA","""Architecture Concepts""
Bernard Tschumi Principal & Lead Designer, Bernard Tschumi Architects

The Zube lecture series is named for Ervin Zube, former head of LARP from 1974 to 1980. Professor Zube is internationally known for his leadership in developing a culture of academic research in the profession of landscape architecture. His research made numerous seminal contributions to landscape planning theory and practice. Ervin left UMass for the University of Arizona, where he continued his renowned research and teaching until he passed away in 2001.

Ervin and his wife Margaret endowed at UMass in 2004 to “bring scholars to the department to stimulate and enrich our academic community in landscape architecture and planning."" The Zube endowment has been supported generously by alumni, students and faculty.

We honor their leadership and generosity through the lecture series which continues to enrich our community with the thoughts and works of local, national and international academic and professional leaders.",https://www.umass.edu/larp/zube-lecture-series,
Poetry Reading: Nathaniel Mackey,"English, Arts",Amherst College and Amherst Books,"Thu, Apr 13, 2017",,8:00 PM,"Amherst Books, Amherst, MA","Nathaniel Mackey is an award-winning poet, novelist, editor and critic. He is the author of numerous books of poetry, including ""Nod House"" (2011), the National Book Award-winning ""Splay Anthem"" (2006), and ""Eroding Witness"" (1985), which was chosen for the National Poetry Series. He has published several book-length installments of his ongoing prose work, ""From a Broken Bottle Traces of Perfume Still Emanate"", beginning with ""Bedouin Hornbook"" in 1986. A New York Times review described the prose project as “not simply writing about jazz, but writing as jazz.” Mackey is the long-time editor of avant-garde literary journal Hambone and currently teaches creative writing at Duke University. The reading will be followed by refreshments.",https://www.amherst.edu/news/calendar/node/671373,
Flowers for the Dead: An Attic Funerary Stele in the Mead Art Museum,"Arts, History, Humanities",Amherst College,"Thu, Apr 13, 2017",,4:30 PM,"Amherst College, Amherst, MA","Seth Estrin, Center for Advanced Study in the Visual Arts at the National Gallery of Art

Emotion does not usually play an important role in our interpretations of ancient sculpture today. But for the ancient Greeks, it could transform how viewers experienced the most basic features of a work of art. Focusing on a fourth-century BCE Attic gravestone in the Mead Art Museum, this talk explores the deeply affective mechanisms through which sculpture functioned in the cemeteries of Classical Athens.",https://www.amherst.edu/academiclife/departments/classics/classics_lectures,
"""Mass Spectrometry from Atoms to Metabolites: Fundamentals and Applications of ICP-MS and Laser Ablation Electrospray Ionization MS""",Science,The Five Colleges,"Thu, Apr 13, 2017",,,"Hampshire College, Amherst, MA","with Professor Samuel Houk, Iowa State University and Ames National Laboratory Department of Chemistry 
",http://www.chem.umass.edu/events/seminarSchedule.html,
"Jennifer Finney Boylan, Long Black Veil","English, Arts, Humanities",Odyssey Bookshop,"Thu, Apr 13, 2017",,7:00 PM,"Odyssey Bookshop, South Hadley, MA","Jennifer Finney Boylan returns to The Odyssey with an atmospheric thriller that explores the meaning of identity, loyalty, and love, a revelatory page-turner about a woman whose family and identity are threatened by the secrets of her past. Boylan poses questions fundamental to the human experience, and answers with disarming humor and empathy. What do we owe to the people of our past? Is it possible to become someone new, or does our history determine our future? And in any life that contains a before and an after, how is it possible to be one person, not two?
 
On a warm August night in 1980, six college students are up to no good inside the dilapidated ruins of Philadelphia’s notoriously haunted Eastern State Penitentiary. It’s not long before they realize they are locked in and not alone, and the terrible night ends in tragedy. Years later, one of them—celebrity chef Jon Casey—will finally be charged with murder, but will Jon’s old friend Judith Carrigan testify to his innocence? Judith is protecting long-held and hard-won secrets of her own, and to defend her friend, she risks not only sacrificing the life she has fought to build but also potentially losing her husband and son. A compelling tale of murder and disappearance, Long Black Veil is also a skillful examination of the universal tension between the people we have been and the people we become.
 
Jennifer Finney Boylan, author of fourteen books, is the inaugural Anna Quindlen Writer-in-Residence at Barnard College of Columbia University. She also serves as the national co-chair of the board of directors of GLAAD, the media advocacy group for LGBT people worldwide. She has been a contributor to the Op-Ed page of the New York Times since 2007; in 2013 she became contributing opinion writer for the page. She serves on the board of trustees of the Kinsey Institute for Research on Sex, Gender, and Reproduction. Jenny also serves as special advisor to the president of Colby College in Maine. She is a consultant and cast member for I Am Cait, the docuseries about Caitlyn Jenner that debuted on the E! network in July of 2015; and also served as a consultant to the Amazon series Transparent. Her 2003 memoir, She’s Not There: A Life in Two Genders was the first bestselling work by a transgender American. A novelist, memoirist, and short story writer, she is also a nationally known advocate for civil rights. Jenny has appeared on the Oprah Winfrey Show on four occasions, Live with Larry King twice, the Today show, the Barbara Walters Special, and NPR’s Marketplace and Talk of the Nation. She has also been the subject of documentaries on CBS News’s 48 Hours and the History Channel. She lives in New York City and in Belgrade Lakes, Maine, with her wife, Deedie, and her two sons, Zach and Sean.",http://www.odysseybks.com/event/jennifer-finney-boylan-long-black-veil,
Spinning in the Valley: The Rise and Fall of the Textile Industry in the Pioneer Valley,"History, Humanities",Greenfield Community College and Pioneer Valley Institute,"Fri, Apr 14, 2017",,7:00-9:00pm,"Greenfield Community College, Greenfield, MA","Learn about the rise of industrial mills along the Connecticut River and its tributaries, the various textiles produced and the status of this industry today.",http://www.gcc.mass.edu/events/spinning-in-the-valley-the-rise-and-fall-of-the-textile-industry-in-the-pioneer-valley-2/,
PB Special Seminar: Male-female communications in plant reproduction,Science,Umass Amherst,"Fri, Apr 14, 2017",,TBD,"Umass Amherst, Amherst, MA","with Lijia Qu, College of Life Sciences, Peking University",http://gpls.cns.umass.edu/pb/seminars?_ga=1.183520870.1905570666.1485282327,
Museum of Art Lecture: Slave Life in the Roman Luxury Villa,"Arts, History, Humanities",Smith College,"Tue, Apr 18, 2017",,7:00-8:30pm,"Smith College, Northampton, MA","Dr. Lauren Petersen discusses slavery in ancient Rome and explores the presence of enslaved people at Villa A on view in the exhibition ""Leisure & Luxury in the Age of Nero"" at the Smith College Museum of Art.",https://www.smith.edu/about-smith/new-calendar?trumbaEmbed=view%3Devent%26eventid%3D214172615,
The Blue House Visitng Writers Series: Kateri Lanthier and January Gill O'Neil,"English, Humanities, Arts",Elms College,"Tue, Apr 18, 2017",,7:00pm-9:00pm,"Elms College, Chicopee, MA","Kateri Lanthier was born in Toronto and raised in St. Catharines, Sudbury and Kingston. Her first collection, Reporting from Night, was published by Iguana Books in 2011. Her poem “The Coin Under the Leftmost Sliding Cup” won the 2013 Walrus Prize and appears in The Best of Walrus Poetry. Lanthier’s second book, Siren, will be released this spring by Vehicule Press.

January Gill O’Neil is the author of Misery Islands and Underlife, both published by CavanKerry Press. Misery Islands received a 2015 Paterson Award for Literary Excellence and won the 2015 Massachusetts Book Award. January is executive director of the Massachusetts Poetry Festival and an assistant professor of English at Salem State University. Her poems and articles have appeared or are forthcoming in Harvard Review, Green Mountains Review, American Poetry Review, Rattle, Ploughshares, Sou’Wester, North American Review, Drunken Boat, and Cave Canem anthologies II and IV, among many others. Underlife was a finalist for ForeWord Reviews Book of the Year Award and the 2010 Paterson Poetry Prize. A Cave Canem fellow, she runs a popular blog called Poet Mom (poetmom.blogspot.com). She lives with her two children in Beverly, Mass.",http://www.elms.edu/calendar/events/home-events/2017-Visiting-Writers-Series,
Slave Life in the Roman Luxury Villa,"History, Humanities",Smith College,"Tue, Apr 18, 2017",,7:00 PM,"Smith College, Northampton, MA","Lauren Hackworth Petersen, University of Delaware

Enslaved people were everywhere in the world of ancient Rome. Yet visitors to sites along the Bay of Naples walk through a landscape that appears untouched by slavery. Scholars and tourists alike have been trained to recognize owners and the free in the archaeological record of ancient Italy and to overlook and ""un-see"" slaves living and laboring in the same place. In her book, The Material Life of Roman Slaves (co-authored with Sandra Joshel), Dr. Lauren Hackworth Petersen seeks to make slaves appear or, more accurately, searches for ways to see them – to make slaves visible where evidence tells us they were in fact present. In her lecture, Dr. Petersen will discuss slavery in ancient Rome and explore the presence of the enslaved at Villa A at Oplontis.",https://www.amherst.edu/academiclife/departments/classics/classics_lectures,
What is Feminist Politics? Cross Generational Dialogue on Feminism ,"History, Humanities, Diversity/Equity/Inclusion, Gender Studies, Social Justice",Five College Women's Studies Research Center,"Wed, Apr 19, 2017",,4:00-6:00pm,"Mount Holyoke College, South Hadley, MA",,https://www.fivecolleges.edu/fcwsrc/events,
Talking Truth Series: 'Finding Work with Meaning in the Anthropocene',"Sustainability, Science, STEM, Social Justice",Umass Amherst,"Wed, Apr 19, 2017",,7:00pm-9:00pm,"Umass Amherst, Amherst, MA","Gain insights into your personal journey toward forward-thinking work in sustainable living and community building within the fields of education, entrepreneurialism, and green building, with Ofer Sharone, assistant professor, Sociology, UMass Amherst, Sara Schley, co-founder of the sustainable consulting firm Seed Systems; Ezra Small , UMass Amherst Sustainability Manager; Sarah Hebert G’13, Trinity Solar employee; and John Fabel, building and construction technology adjunct faculty member, UMass Amherst.

The UMass Amherst Libraries host a series of interactive climate change events.

Now in its second year, the series is organized by Talking Truth: Finding Your Voice Around the Climate Crisis, a collaborative community comprised of UMass Amherst students, faculty, and staff working together to integrate the intellectual, emotional and spiritual dimensions of climate change. 

The theme of the spring 2017 series is “Living and Working with Purpose in a Time of Climate Disruption.”

All events are free and open to the public. Seating is limited, please arrive early. 
",http://www.umass.edu/events/talking-truth-series-finding,
Distinguished Faculty Lecture: Nilanjana Dasgupta,"Diversity/Equity/Inclusion, Counseling, STEM, Leadership, Science, Gender Studies, Social Justice, Featured",Umass Amherst,"Wed, Apr 19, 2017",,4:00 PM,"Umass Amherst, Amherst, MA","The choice to pursue a given professional path may feel free but is often constrained by subtle social cues about who does and doesn’t “belong there.” This lecture will show how such constraints can be lifted to allow students real freedom to pursue any academic and professional path, especially ones where their group is underrepresented. It will review highlights from a decade of research identifying people and environments in high-achieving academic settings that act as “social vaccines” to inoculate young women’s self-confidence, motivation, and persistence, protecting them against negative stereotypes.

The presentation will conclude by showcasing evidence-based remedies that may be leveraged to recruit and retain more women in STEM courses, majors, and careers, thereby increasing and diversifying the STEM workforce for the 21st century.

Professor Dasgupta will be presented with the Chancellor’s Medal, the highest recognition bestowed to faculty by the campus, at the conclusion of the lecture.

This lecture is free and open to the public. For information, call 413-577-1101.",http://www.umass.edu/events/distinguished-faculty-lectur-5,X
Poetry Reading: James Lenfestey,"English, Arts, Humanities",Greenfield Community College,"Wed, Apr 19, 2017",,12:00pm-1:00pm,"Greenfield Community College, Greenfield, MA","The Friends of Archibald MacLeish sponsor the Third Annual Archibald MacLeish Poetry Reading featuring James P. Lenfestey.

After a career in academia, advertising and journalism as an editorial writer at the Minneapolis StarTribune, where he won several Page One awards for excellence, James P. Lenfestey has published poetry, reviews and articles.

Since 2000, he has published a book of personal essays, five poetry collections, and edited two popular poetry anthologies, Low Down and Coming On: A Feast of Delicious and Dangerous Poems About Pigs (Red Dragonfly Press, 2010) and If Bees are Few: A Hive of Bee Poems (Univ. of Minnesota Press, 2016), and co-edited a collection of essays on the life and career of Robert Bly, Robert Bly in this World (University of Minnesota Press, 2011).

His memoir, Seeking the Cave: A Pilgrimage to Cold Mountain (Milkweed Editions, 2014) was a finalist for the Minnesota Book Award.

Lenfestey chairs the Literary Witnesses poetry program in Minneapolis and teaches poetry every summer at the Grand Hotel on Mackinac Island, Michigan. As a journalist he has covered and spoken about climate science since 1988.

Free and open to the public.",http://www.gcc.mass.edu/events/poetry-reading-james-lenfestey/,
"Hannah Tinti, The Twelve Lives of Samuel Hawley","English, Arts, Humanities",Odyssey Bookshop,"Wed, Apr 19, 2017",,7:00 PM,"Odyssey Bookshop, South Hadley, MA","Samuel Hawley isn’t like the other fathers in Olympus, Massachusetts. A loner who spent years living on the run, he raised his beloved daughter, Loo, on the road, moving from motel to motel, always watching his back. Now that Loo’s a teenager, Hawley wants only to give her a normal life. In his late wife’s hometown, he finds work as a fisherman, while Loo struggles to fit in at the local high school.
 
Growing more and more curious about the mother she never knew, Loo begins to investigate. Soon, everywhere she turns, she encounters the mysteries of her parents’ lives before she was born. This hidden past is made all the more real by the twelve scars her father carries on his body. Each scar is from a bullet Hawley took over the course of his criminal career. Each is a memory: of another place on the map, another thrilling close call, another moment of love lost and found. As Loo uncovers a history that’s darker than she could have known, the demons of her father’s past spill over into the present—and together both Hawley and Loo must face a reckoning yet to come.
 
A coming-of- age novel and a literary thriller that weaves back and forth through time and across America, from Alaska to the Adirondacks, The Twelve Lives of Samuel Hawley is an unforgettable story about the cost we pay to protect the people we love most.

Hannah Tinti grew up in Salem, Massachusetts. Her short story collection Animal Crackers was a runner-up for the PEN/Hemingway Award. Her bestselling novel The Good Thief won the Center for Fiction First Novel Prize and an American Library Association Alex Award, and was a New York Times Notable Book of the Year. Tinti is the co-founder and editor-in-chief of the award-winning literary magazine One Story.
 ",http://www.odysseybks.com/event/hannah-tinti-twelve-lives-samuel-hawley,
Living Building Tour,"Science, Sustainability, Architecture, Social Justice",Hitchcock Center for the Environment at Hampshire College,"Wed, Apr 19, 2017",,12:00 PM,"Hitchcock Center for the Environment, Amherst, MA","Public Building Tours: Spring Tour Dates First Fridays at 4pm: April 7, May 5, June 2 Third Wednesdays at 12pm: April 19, May 17, June 21 FREE but please register online. Come meet our newest educator – our building! It is designed to model systems in nature, it is net zero energy, net zero water, has composting toilets, and has been made with responsibly sourced non-toxic materials, come check it out at one of our bi-monthly tours.",http://www.hitchcockcenter.org/event/living-building-tour-4/,
Gail Thomas & Naila Moreira Poetry,"Arts, English, Humanities",Smith College Poetry Center,"Thu, Apr 20, 2017",,4:00-5:30pm,"Smith College, Northampton, MA","Faculty & Staff Poetry Reading: Gail Thomas & Naila Moreira
Gail Thomas and Naila Moreira will read from their new chapbooks-- all are welcome to attend.",https://www.smith.edu/about-smith/new-calendar?trumbaEmbed=view%3Devent%26eventid%3D215742164,
Landscape Architecture and Urbanism,Architecture,Umass Amherst,"Thu, Apr 20, 2017",,,"Umass Amherst, Amherst, MA","""Landscape Architecture and Urbanism""
Dirk Sijmons Co-founder,  H+N+S Landscape Architects

The Zube lecture series is named for Ervin Zube, former head of LARP from 1974 to 1980. Professor Zube is internationally known for his leadership in developing a culture of academic research in the profession of landscape architecture. His research made numerous seminal contributions to landscape planning theory and practice. Ervin left UMass for the University of Arizona, where he continued his renowned research and teaching until he passed away in 2001.

Ervin and his wife Margaret endowed at UMass in 2004 to “bring scholars to the department to stimulate and enrich our academic community in landscape architecture and planning."" The Zube endowment has been supported generously by alumni, students and faculty.

We honor their leadership and generosity through the lecture series which continues to enrich our community with the thoughts and works of local, national and international academic and professional leaders.",https://www.umass.edu/larp/zube-lecture-series,
"Active Transportation for a Healthy, Sustainable Planet","Athletics, Health, Science, Sustainability, Student Life, Global Studies, Social Justice",Westfield State University,"Thu, Apr 20, 2017",,7:00 PM,"Westfield State University, Westfield, MA","Dr. Janet Walberg Rankin has established the ActivEarth Initiative, which promotes global change through active transportation and combines physical activity, environmental stewardship and economic viability to make the world a healthier place to live. Her presentation will touch upon many different areas such as the health of the body, environment, and transportation.  Her current research includes determining predictors and barriers of active transportation (walking and biking) as a means to increase physical activity, and the exploration of the co-benefits of active transportation on health the environment and the economy.",http://www.westfield.ma.edu/events/view/active-transportation-for-a-healthy-sustainable-planet,
"Bulgaria's Cultural Heritage: Thrace, Greece, Rome","Humanities, Global Studies",Umass Amherst Classics Department,"Thu, Apr 20, 2017",,5:00 PM,"Umass Amherst, Amherst, MA","with Assistant Professor Vyara Kalfina, Department of History and Theory of Culture
Sofia University, Bulgaria",http://www.umass.edu/classics/event/bulgarias-cultural-heritage,
"The Evolution of Cabot Station, Turners Falls","History, Humanities",Greenfield Community College and Pioneer Valley Institute,"Fri, Apr 21, 2017",,6:30-8:30pm,"Greenfield Community College, Greenfield, MA",An interactive historical review of the construction of Cabot Station at Montague City by historian Ed Gregory. Mr. Gregory will trace the history of this power station from its beginnings in 1914 when it was New England’s largest hydro-power facility to today’s computerized operation. Learn about the evolution of one of the largest electric power producers in Western Mass through vintage photos. This is in conjunction with the 100th anniversary of hydroelectricity at Cabot Station.,http://www.gcc.mass.edu/events/spinning-in-the-valley-the-rise-and-fall-of-the-textile-industry-in-the-pioneer-valley/,
