Name,Category,Organization,Date,End Date,Time,Location,Description,URL,Emily: 👍
Fiction Reading: James Hannaham,"English, Arts, Journalism",Amherst College and Amherst Books,"Wed, Mar 22, 2017",,8:00 PM,"Amherst Books, Amherst, MA","James Hannaham is the author of two novels, ""God Says No"", which was a Stonewall Honor Book and a Lambda Book Award finalist, and ""Delicious Foods"", which was a New York Times and Washington Post Notable Book for 2015, and which Tayari Jones described as “A completely unforgettable, original, and singular novel by a brave, exciting new writer.” or, as Rebecca Lee put it, “Bury me with this book, so I will remember how wonderful living was.” Hannaham has also widely published short fiction, journalism and criticism in The Literary Review, The Village Voice, Spin, Out, The New York Times Magazine, Slate, and Salon, among other places. The reading will be followed by refreshments.",https://www.amherst.edu/news/calendar/node/671370,
Addiction & Recovery in Our Community: Many Paths to Recovery,"Health, Counseling, Student Life",Westfield State University,"Wed, Mar 22, 2017",,9:00 AM,"Westfield State University, Westfield, MA","According to the Surgeon General’s Report on Alcohol, Drugs and Health (2016) an estimated 20.8 million people in the United States live with clinically diagnosed substance abuse disorder.  For every person addicted, family members, friends and loved ones are also impacted. In 2017, 1,745 people lost their lives from an opioid overdose in Massachusetts.

Dr. Robert Roose, Chief Medical Officer of Addiction Services at Sisters of Providence Health System and member of the Massachusetts Governor’s Opioid Addiction Working Group, will address the status of the current opioid epidemic in Massachusetts, what progress has been made, what work is underway, and provide recommendations to aid our ongoing community response to promote paths to recovery.

Following the presentation, a panel of leaders in many service areas in our community will lead a discussion to normalize the prevalence of addiction and identify various opportunities for “recovery encounters”.

At the conclusion of the panel discussion, Dr. Stephen Lee will demonstrate how to use narcan, and attendees will have an opportunity to network with many of our region’s substance abuse professionals.",http://www.westfield.ma.edu/events/view/addiction-recovery-in-our-community-many-paths-to-recovery,
Re-imagining the Greeks: Contemporary and Cross-cultural Approaches to Greek Tragedy,"Arts, Theater, Music, Dance, English, Humanities, History",Amherst College Theater and Dance Department,"Thu, Mar 23, 2017","Sat, Mar 25, 2017",Various times,"Amherst College, Amherst, MA","March 23, 2017-March 25-2017

Each day will be devoted to a different region of the world, and its cultural relationship with the ancient Greeks. The first day will be about Japanese adaptations, the second about Black interpretations (African and American), and the third about American adaptations. The conference will combine scholarly discussions, workshops, non-western performative approaches. And live performances. Participation in the workshops is open to students and professionals with experience in performing. 

As part of the interdisciplinary approach of our department, the conference aims to combine the theory and practice of various disciplines. Accordingly, scholarly discussions will be intertwined with workshops in which we employ non-western performative traditions in the exploration of ancient Greek texts. Live performances will also be scheduled.

We will bring together people from diverse disciplines and backgrounds: practitioners, scholars and the general public. Participation in the workshops is open to students and professionals with experience in performing.

Free and open to the public; registration required. ",https://www.amherst.edu/academiclife/departments/theater_dance/performances/conference,X
Massachusetts Downtowns: Efforts at the State Level,Architecture,Umass Amherst,"Thu, Mar 23, 2017",,,"Umass Amherst, Amherst, MA","""Massachusetts Downtowns: Efforts at the State Level""
Elizabeth Hahn Program Coordinator, Massachusetts Downtown Initiative (MDI) 

The Zube lecture series is named for Ervin Zube, former head of LARP from 1974 to 1980. Professor Zube is internationally known for his leadership in developing a culture of academic research in the profession of landscape architecture. His research made numerous seminal contributions to landscape planning theory and practice. Ervin left UMass for the University of Arizona, where he continued his renowned research and teaching until he passed away in 2001.

Ervin and his wife Margaret endowed at UMass in 2004 to “bring scholars to the department to stimulate and enrich our academic community in landscape architecture and planning."" The Zube endowment has been supported generously by alumni, students and faculty.

We honor their leadership and generosity through the lecture series which continues to enrich our community with the thoughts and works of local, national and international academic and professional leaders.",https://www.umass.edu/larp/zube-lecture-series,
What Drives Mass Incarceration in the United States and Here in Massachusetts,"History, Humanities, Diversity/Equity/Inclusion, Gender Studies, Social Justice",Edwards Public Library,"Thu, Mar 23, 2017",,6:30pm-8:00pm,"Edwards Public Library, Southampton, MA","Join Lois Ahrens, Founding Director of the Real Cost of Prisons Project and Founding Member of the National Council for Incarcerated and Formerly Incarcerated Women and Girls in exploring how our prisons and jails have grown from 250,000 incarerated women and men in the 1970's to 2-3 million women and men incarcerated today. And, what you can do about it.",http://forbeslibrary.libcal.com/event/1197075,
Fiction Reading: Amity Gaige,"English, Arts, Humanities",Springfield College,"Thu, Mar 23, 2017",,7:30pm-8:30pm,"Sprinfield College, Springfield, MA","Amity Gaige is the author of three novels, O My Darling, The Folded World, and Schroder, which was shortlisted for the Folio Prize in 2014. In 2006, she was recognized as one of the “5 Under 35” outstanding emerging writers by the National Book Foundation. Gaige is the winner of a Fulbright fellowship, a Guggenheim fellowship, fellowships at the MacDowell Colony and Yaddo artists’ retreat, and a Baltic Writing Residency. A book signing will follow the reading.

This event is part of the spring 2017 William Simpson Fine Arts Series.",http://wordpress.springfieldcollege.edu/calendar/?tribe_events=fiction-reading-amity-gaige#.WK4A5hIrKqA,
Geology Symposium: Mineral Resources for a Sustainable Future,"Science, Sustainability, Global Studies, STEM",Smith College,"Fri, Mar 24, 2017","Sat, Mar 25, 2017",All day,"Smith College, Northampton, MA","This two-day conference will dive into the status, challenges and opportunities in the field of ore deposit and mineral resource exploration, which is critical for developing sustainable, non-carbon-based technologies, and for guiding future curricular and hiring decisions.

Lawrence D. Meinert, program coordinator of the Mineral Resources Program of the U.S. Geologic Survey in Washington D.C., will deliver the keynote address on the future of mineral resources.

There will be a dinner on Friday evening during the keynote address, followed by lectures, lunch, and an early afternoon panel discussion on Saturday.

Potential other speakers (maximum 4 for a total of 5 speakers including keynote):

John F.H. Thompson – SEG Distinguished Lecturer; the Wold Professor of Environmental Balance for Human Sustainability at Cornell University

Murray W. Hitzman – SEG International Exchange Lecturer; Associate Director for Energy and Minerals at USGS

M. Stephen Enders – SEG Honorary Lecturer; Interim Department Head and Research Professor of Economic Geology, Department of Geology and Geological Engineering, Colorado School of Mines

Sarah Gleeson – Professor, Department of Earth & Atmospheric Sciences, University of Alberta; currently located in Potsdam, Germany, where she was recruited to help restart Europe's economic geology program

Jessica Kogel – Associate Director for Mining (ADM) in the Office of the Director of the National Institute for Occupational Safety and Health (NIOSH)",https://www.fivecolleges.edu/calendar-of-events/listings/node/161242,
Geology Symposium: Mineral Resources for a Sustainable Future,"Science, Sustainability, Global Studies, STEM",Smith College,"Fri, Mar 24, 2017","Sat, Mar 25, 2017",All day,"Smith College, Northampton, MA","This two-day conference will dive into the status, challenges and opportunities in the field of ore deposit and mineral resource exploration, which is critical for developing sustainable, non-carbon-based technologies, and for guiding future curricular and hiring decisions.

Lawrence D. Meinert, program coordinator of the Mineral Resources Program of the U.S. Geologic Survey in Washington D.C., will deliver the keynote address on the future of mineral resources.

There will be a dinner on Friday evening during the keynote address, followed by lectures, lunch, and an early afternoon panel discussion on Saturday.

Potential other speakers (maximum 4 for a total of 5 speakers including keynote):

John F.H. Thompson – SEG Distinguished Lecturer; the Wold Professor of Environmental Balance for Human Sustainability at Cornell University

Murray W. Hitzman – SEG International Exchange Lecturer; Associate Director for Energy and Minerals at USGS

M. Stephen Enders – SEG Honorary Lecturer; Interim Department Head and Research Professor of Economic Geology, Department of Geology and Geological Engineering, Colorado School of Mines

Sarah Gleeson – Professor, Department of Earth & Atmospheric Sciences, University of Alberta; currently located in Potsdam, Germany, where she was recruited to help restart Europe's economic geology program

Jessica Kogel – Associate Director for Mining (ADM) in the Office of the Director of the National Institute for Occupational Safety and Health (NIOSH)",https://www.fivecolleges.edu/calendar-of-events/listings/node/161242,
"Talk by Cornell William Brooks, president and CEO of NAACP","Diversity/Equity/Inclusion, History, Humanities",Amherst College,"Fri, Mar 24, 2017",,8:00pm-9:00pm,"Amherst College, Amherst, MA","Cornell William Brooks is the president and CEO of the National Association for the Advancement of Colored People (NAACP), the nation’s oldest, largest and most widely respected civil rights organization. In 2014, he became the 18th chief executive of the organization. With branches in every state and more than a half-million members and supporters in the US and abroad, NAACP members advocate for civil rights, fight against police brutality, conduct voter mobilization campaigns and advocate for equal opportunity in their communities.

This talk is free and open to the public.",https://www.amherst.edu/news/calendar/node/672033,X
"""Exceptional Mobility: Low Income Youth in Pursuit of the Latino-American Dream"" Faculty Colloquium Series: Leah Schmalzbauer","Diversity/Equity/Inclusion, Humanities, History, Counseling, Student Life",Amherst College,"Fri, Mar 24, 2017",,12:00pm-1:00pm,"Amherst College, Amherst, MA","On Friday, March 24, from noon to 1 p.m., the Faculty Colloquium Series for 2016-17 is sponsoring ""Exceptional Mobility: Low Income Youth in Pursuit of the Latino-American Dream"" presented by Leah Schmalzbauer, associate professor of american studies and sociology. This event will take place in the Mullins and Faerber rooms, Lewis-Sebring Commons.",https://www.amherst.edu/news/calendar/node/656566,
Information & Communication Technology Summit,"STEM, Science, Math, Arts, Journalism, History, Humanities",Information Technology Program at Umass Amherst,"Fri, Mar 24, 2017",,9:00am-4:00pm,"Umass Amherst, Amherst, MA","This year’s theme is ‘Technology for All’. We will explore how IT is being used in the arts, humanities, social and physical sciences.

For all faculty, students, and the 5 college community

On the 24th, the Summit will include a tech fair that showcases a wide variety of technologies, from 3D printing to mobile apps, developed by members of the 5 College community as well as innovations from the corporate world. The Summit will also include presentations and panel discussions on information technology across the disciplines.

-David McLaughlin: Technology for All
-Franz Strasser: Journalism in Digital Age: use of 360° camera and live streaming

Internet Policy & Law
-Tracy Mitrano, Academic Dean of the University of Massachusetts Cybersecurity Programs
-Ria Bailey Galvis, Google-Public Policy & Government Relations, International Relations Analyst

News, Noise and Misinformation
-Nabanita De: FiB: Detection of Fake News from Facebook
-Joshua Stearns: First Draft News, Verification Junkie
-Kate Freedman: Creating Digital Citizens

Visualization & Communication
-Eli Schiff: UX/UI Design , Writer, Humanist Interface
-Georges Grinstein: Scientific Data Visualization: Information Visualization & Visual Analytics",http://www.umass.edu/itprogram/content/ict-summit-2017,X
35th Annual New England Saxophone Symposium,"Arts, Music",Umass Amherst,"Sat, Mar 25, 2017",,7:00 AM,"Umass Amherst, Amherst, MA","The Department of Music and Dance presents the 35th Annual New England Saxophone Symposium, hosted and coordinated by Jonathan Hulting-Cohen & Felipe Salles, with guests Arno Bornkamp (classical) and Steve Wilson (jazz).

The symposium will include masterclasses, concerts, high school/collegiate showcases & competitions.",http://www.umass.edu/events/35th-annual-new-england,
Film Screening with Discussion of the Documentary The Castro Tapes,"History, Humanities, Global Studies",Springfield Public Library,"Sat, Mar 25, 2017",,3:15pm-5:00pm,"Springfield Public Library, Sixteen Acres Branch, Springfield, MA","Please join us for a free showing and discussion of a terrific PBS documentary, The Fidel Castro Tapes.  According to the producer: ""To some an icon of resistance and to others the very face of dictatorial oppression, Fidel Castro was one of the most provocative political figures of the 20th century. The Fidel Castro Tapes  chronicles how his drive and charisma catapulted him to power in Cuba and how he used these traits to maintain control of his country for nearly five decades and capture the attention of the world.""  

There will be a discussion after the documentary that will feature a special guest, Sixteen Acres resident and former Springfield City Councilor and Clodo Concepcion.  Clodo grew up in Cuba, the  second of 12 children, on a tobacco farm under the Batista government.  He came to the United States in 1956. ",http://www.eventkeeper.com/mars/xpages/xp_popevent.cfm?zeeOrg=SPRNGFLD&EventID=4957154,
Voices Carry: Voices from Inside Reading,"Arts, Humanities, English, History, Humanities, Diversity/Equity/Inclusion",Emily Williston Memorial Library and Voices From Inside,"Sat, Mar 25, 2017",,1:00pm-2:00pm," Emily Williston Memorial Library, Easthampton, MA","Voices from Inside makes a difference in the lives of incarcerated women by giving them the opportunity to find their voices and the power to change their lives through creative writing workshops.

http://www.voicesfrominside.org/

Date:
",http://forbeslibrary.libcal.com/event/1195349,
Redefine – Reunite- Reenter: Promoting Health and Well Being through Physical Activity for Non-Military Persons with Disability,"Athletics, Health, Counseling, Diversity/Equity/Inclusion, History, Humanities",Springfield College,"Sat, Mar 25, 2017",,7:00pm-9:00pm,"Springfield College, Springfield, MA","The annual Karpovich lecture is scheduled for Tuesday, April 25, 2017, at 7 p.m. in Fuller Arts Center. This year’s lecturer is Ronald Davis, PhD, from Texas Women’s University. His lecture is titled “Redefine – Reunite- Reenter: Promoting Health and Well Being through Physical Activity for Non-Military Persons with Disability.”

Davis is one of the leading professionals on adapted physical activity and sport for persons with disabilities. He currently serves on the board of the Paralympic Research and Sports Science Consortium, is past-president of the National Consortium for Physical Education and Recreation for Individuals with Disabilities, and served as former director of Athlete Classification for the 1996 Atlanta Paralympics. Davis has also co-directed Paralympic training campus for our U.S. Paralympic teams headed to Korea, Barcelona, and Atlanta. His research interests have included projects related to kinematics for seated shot-put; hand placement of seated volleyball athletes; and the physical affect of wounded, ill, or injured wheelchair basketball players.",http://wordpress.springfieldcollege.edu/calendar/?tribe_events=karpovich-lecture-3#.WK7qAhIrI_U,
27th Annual Phyllis Williams Lehmann Lecture: New Research Strategies and Recent Discoveries at Oplontis,"Arts, History, Humanities, Global Studies",Archaeological Institute of America-Western Massachusetts Society and the Smith College Museum of Art,"Sat, Mar 25, 2017",,11:00 AM,"Smith College, Northampton, MA","John R. Clarke, Regents Professor at the University of Texas at Austin, will present results of the work of the Oplontis Project with emphasis on the current exhibition, Leisure and Luxury in the Age of Nero: The Villas of Oplontis near Pompeii. Since 2006, Dr. Clarke's research team has had the charge from the Italian Ministry of Culture to study, excavate and write about the Roman villas first uncovered in 1964 at Torre Annunziata, Italy. Dr. Clarke will highlight the most innovative techniques employed in the Project’s investigations and will present the discovery, in 2014–2016, of the long-lost sea façade of the structure known as Villa A.",https://www.amherst.edu/academiclife/departments/classics/classics_lectures,
Rotunda Rhythms Presents The Softer Side of Celtic: Music and Stories,"Music, Arts, English, History, Humanities, Global Studies",Springfield Public Library and the Springfield Cultural Council,"Sun, Mar 26, 2017",,2:00pm-3:00pm,"Springfield Public Library, Central Library, Springfield, MA","The Softer Side of Celtic brings the stories of music from Scotland, Ireland and England into a program that will keep the audience on the edge of their seats. There will be singing, laughing, clapping, and perhaps a few tears, as he tells the songs' stories. Jeff Snow is a highly regarded guitarist who also plays the autoharp, bouzouki, and other instruments. His relaxed presentation is warm and friendly, perfect for children, teens, and adults. Attendees earn a chance to win the free raffle sponsored by the Friends of the Library. This program is sponsored in part by the Springfield Cultural Council.",http://www.eventkeeper.com/mars/xpages/xp_popevent.cfm?zeeOrg=SPRNGFLD&EventID=4893593,
"""'Earthen Ware, made in Boston:' Benjamin Leigh and John Allman’s Revolutionary Partnership""
Presented by Angelika Kuettner, Associate Curator of Ceramics, Colonial Williamsburg Foundation","History, Arts, Humanities",Historic Deerfield,"Sun, Mar 26, 2017",,2:00 PM,"Deerfield Community Center, Deerfield, MA","This talk is part of the Winter Lecture Series: Revolutionary Acts: Tea, Taxes and Tempests

In 1763, Massachusetts Bay celebrated the birthday of King George III with banquets and toasts, parades and fireworks. Ten years later, Massachusetts teetered on the brink of open rebellion as colonists denounced the British Parliament’s new taxes on imported goods. Join us as we commemorate the 250th anniversary of the Townshend Acts in a winter lecture series exploring the politics of tea, consumer culture, and resistance on the eve of the American Revolution.

All lectures begin at 2 p.m. at the Deerfield Community Center and are free and open to the public.",http://www.historic-deerfield.org/event/lectures/winter-lecture-series-revolutionary-acts-tea-taxes-and-tempests/?eID=21884,
Revolution in Fashion 1914-1920 by Patricia C. Warner,"History, Humanities, Arts, Gender Studies",The Stone House Museum/Belchertown Historical Association,"Sun, Mar 26, 2017",,2:00pm-3:15pm,"Stone House Museum, Belchertown, MA","World War I changed everthing. One of the many legacies that continues to shape our lives today is women’s clothing. Recollect the fashions featured in the second season of the popular PBS drama Downton Abbey which is set in the years 1916 – 1919. Join us at the Stonehouse to learn about how and why the revolutionay changes came about during this period in our history.

Professor Warner has published and spoken widely in various scholarly journals and books on various aspects of the history of dress, including jewelry, slave clothing and the movies, but her major focus has been the subject of her book, When the Girls Came Out to Play (University of Massachusetts Press, 2006), on women’s clothing for sports and the birth of American sportswear. She is a Fellow of the Costume Society of America.",http://stonehousemuseum.org/event/592/?instance_id=151,
Concert: Magic Triangle Jazz Series presents: Mary Halvorson's Reverse Blue,"Arts, Music",Umass Amherst,"Mon, Mar 27, 2017",,8:00 PM,"Umass Amherst, Amherst, MA","Free admission.

The Magic Triangle Jazz Series, produced by the Fine Arts Center at the University of Massachusetts, Amherst, in collaboration with the Smith College Department of Music, continues its 28th season with a performance by Mary Halvorson’s Reverse Blue, featuring Mary Halvorson, guitar, Chris Speed, saxophone, clarinet, Eivind Opsvik, bass and Tomas Fujiwara, drums. The concert is free and open to the public.

One of improvised music’s most in-demand guitarists, Mary Halvorson has been active in New York since 2002, following jazz studies at Wesleyan University and the New School. Critics have called her “a singular talent” (Lloyd Sachs, JazzTimes), “NYC’s least-predictable improviser” (Howard Mandel, City Arts), “one of the most exciting and original guitarists in jazz—or otherwise” (Steve Dollar, Wall Street Journal), and “one of today’s most formidable bandleaders” (Francis Davis, Village Voice). 

After three years of study with visionary composer and saxophonist Anthony Braxton, Halvorson became an active member of several of his bands, including his trio, septet and 12+1tet. To date, she has appeared on six of Braxton’s recordings. Halvorson has also performed alongside iconic guitarist Marc Ribot, in his bands Sun Ship and The Young Philadelphians, and with the bassist Trevor Dunn in his Trio-Convulsant. Over the past decade she has worked with such diverse bandleaders as Tim Berne, Taylor Ho Bynum, Ingrid Laubrock, Myra Melford, Jason Moran, Joe Morris, Tom Rainey and Mike Reed.

As a bandleader and composer, one of Ms. Halvorson’s primary outlet is her longstanding trio, featuring bassist John Hébert and drummer Ches Smith. Since their 2008 debut album, Dragon’s Head, the band has been recognized as a rising star jazz band by Downbeat Magazine for five consecutive years. Ms. Halvorson’s quintet, which adds trumpeter Jonathan Finlayson and alto saxophonist Jon Irabagon to the trio, has released two critically acclaimed albums on the Firehouse 12 label: Saturn Sings and Bending Bridges. Most recently she has added two additional band members—tenor saxophonist Ingrid Laubrock and trombonist Jacob Garchik—to form a septet, featured on her 2013 release, Illusionary Sea. Halvorson also co-leads a longstanding chamber-jazz duo with violist Jessica Pavone, the avant-rock band People and the collective ensembles Thumbscrew and Secret Keeper.

“In the past few years, Mary Halvorson, already an acclaimed member of New York's Downtown improv scene, has been earning widespread recognition as a bandleader and composer of note,” writes Troy Collins. “Her writing displays an increasing sophistication with each new effort, revealing a compositional maturity as distinctive as her idiosyncratic guitar technique. Her latest ensemble, Reverse Blue, first performed at NYC's Blue Note as part of Search and Restore's ‘Spontaneous Constructions’ series. Despite their mixed pedigree, there is an aesthetic similarity amongst the tunes that lends a sense of stylistic cohesion to the proceedings. Cohesive, yet varied enough to signify its collaborative nature, Reverse Blue is another exceptional release from one of today's most adventurous artists.”",http://www.umass.edu/events/concert-magic-triangle-jazz-0,
Collateral Consequences,"History, Humanities, Diversity/Equity/Inclusion, Social Justice",Forbes Public Library,"Mon, Mar 27, 2017",,7:00pm-8:00pm,"Forbes Public Library, Coolidge Museum, Northampton, MA","Panel conversation with four Massachusetts residents with direct experience with incarceration. Elaine Arsenault, Veronica McNair, Donald Perry, and Jafet Robles will share their stories and views, providing a first-hand, human perspective on the effects of being directly impacted by the carceral state.",http://forbeslibrary.libcal.com/event/1195348,
