Name,Category,Organization,Date,End Date,Time,Location,Description,URL,Emily: 👍
Nationalism and the Rise of the Right: Comparative Perspectives,"History, Humanities, Global Studies",Mount Holyoke College and McCulloch Center for Global Initiatives,"Sat, Feb 11, 2017",,7:00pm-9:00pm,"Mount Holyoke College, South Hadley, MA","Sponsored by McCulloch Center, Politics Department and International Relations Department",https://events.mtholyoke.edu/MasterCalendar/EventDetails.aspx?EventDetailId=42518,
Choices Facing the United States: Greater Israel or Global Israel,"Humanities, Global Studies, History",Smith College,"Mon, Feb 20, 2017",,4:30-5:30pm,"Smith College, Northampton, MA","Daniel Kurtzer, former American Ambassador to Egypt and Israel will be speaking at Smith College.",https://www.fivecolleges.edu/calendar-of-events/listings/node/162181,
Africa’s Great Civilizations,"Humanities, Global Studies, History","WGBY (Western MA Public Television), the Five College African Studies Program, and the UMass Department of History","Tue, Feb 21, 2017",,4:30-6:00pm,"Umass Amherst, Amherst, MA","The presentation will begin with refreshments and short program of African Music and Dance, followed by a 30-minute screening of a portion of Africa’s Great Civilizations, a major new PBS series hosted by Henry Louis Gates, Jr., premiering on WGBY in February. The program will conclude with a discussion and Q&A. Program participants include Five College African Studies Professors Joye Bowman, John Higginson, Olabode Omojola, and Marilyn Sylla.

This program is presented by WGBY, the Five College African
Studies Program and the UMass Department of History.",https://www.fivecolleges.edu/african/events/node/162083,
"Her Body, Our Laws: On the Frontlines of the Abortion War from El Salvador to Oklahoma","Humanities, History, Global Studies, Diversity/Equity/Inclusion, Gender Studies, Social Justice","Smith College Department of Anthropology, the Smith College Program for the Study of Women and Gender, the Five College Cultural, Health and Science program, and the Smith College Lecture Committee","Tue, Feb 21, 2017",,5:00-6:00pm,"Smith College, Northampton, MA","A nationally recognized scholar on legal issues surrounding adolescence, pregnancy, and motherhood, Professor Oberman will present work from her forthcoming book exploring women and abortion at the intersections of law, policy, and medicine in the U.S. and Latin America.

This event is sponsored by the Smith College Department of Anthropology, the Smith College Program for the Study of Women and Gender, the Five College Cultural, Health and Science program, and the Smith College Lecture Committee.",https://www.fivecolleges.edu/chs/events/node/162267,
Political Thirst: The Control of Water in North Africa - A Roundtable Discussion,"Humanities, History, Global Studies",,"Tue, Feb 21, 2017",,5:00-6:30pm,"Smith College, Northampton, MA","Professor Alan Mikhail from Yale University with Smith faculty: Greg White, Mukaram Hhana, and Alex Seggerman will offer short faculty presentations, along with interdisciplinary discussion and will address issues surrounding the control of water in North Africa from historical, environmental, political, and artistic perspectives. The conversation will highlight how controlling, exploiting, and sustaining water has been central to political power in the region for centuries.  ",https://www.fivecolleges.edu/middleeast/events/node/162420,
"Dr. Casey Stevens Bester, Duke University: ""An Impactful Experiment: Impact, Penetration and Cratering in Granular Media""","Science, STEM, Math",Amherst College,"Tue, Feb 21, 2017",,4:45pm-6:00pm,"Amherst College, Amherst, MA","Examples of granular materials, or large collections of discrete macroscopic grains, exist in abundance, from rice and cereal to sand and rocks. However, the physics of granular media present significant complexities that are still poorly understood. Impact of granular targets by solid projectiles is an experimental approach to understanding force transmission in soft matter. A granular target can cause a free-falling projectile to come to an abrupt stop as its momentum is dissipated to the grains. A complete interpretation of the stopping force, incorporating grain-scale interactions during impact, remains unresolved. We use direct force measurements and high-speed imaging to determine the forces acting on a projectile as it decelerates through a dense granular medium. These impact studies probe the unique response and properties of granular media.",https://www.amherst.edu/academiclife/departments/physics/seminars_and_colloquia/node/652287,
The Long Island Century Bat Survey,"Science, Sustainability",Westfield State University,"Tue, Feb 21, 2017",,7:00 PM,"Westfield State University, Westfield, MA","Michael Fishman is a Certified Wildlife Biologist, and serves as the Director of Biological Field Services at ERM (Environmental Resources Management), an international sustainability consultancy. He has worked as an endangered species biologist throughout the U.S., and for the past 25 years has focused on threatened and endangered bat species.

Bat populations in the Northeast have been decimated over the past decade by a fungal pathogen known as White Nose Syndrome (WNS). Mr. Fishman developed a bat research program on Long Island, New York, to determine how WNS had impacted bat populations there. The resulting Long Island Century Bat Survey (LICBS), the most intensive bat survey conducted on Long Island in more than 100 years, revealed some surprising results. Bat species that were all but extirpated on the mainland continued to thrive on Long Island.

Michael will discuss this work, as well as continuing bat research that was spawned from the LICBS, which has found that this effect is exhibited along the Northeastern coastal plain. He will discuss hypotheses currently being explored to determine why bats infected with WNS are surviving in the coastal plain, and the implications this may have for long-term bat species conservation.",http://www.westfield.ma.edu/guest-lecture-series,
"Faculty Works in Progress Research Seminar ""Feminist Activism""","History, Humanities, Diversity/Equity/Inclusion, Gender Studies, Social Justice",Five College Women's Studies Research Center,"Wed, Feb 22, 2017",,6:00-8:00pm,"Mount Holyoke College, South Hadley, MA","Laura Lovett (Department of History, UMass Amherst) ""With Her Fist Raised: Dorothy Pitman Hughes and the Activist's Life""

Traci Parker (Department of Afro-American Studies, UMass Amherst) ""Workers, Consumers, and Civil Rights: African American Women's Activism and Class Formation/Mobility in the Mid-Twentieth Century""",https://www.fivecolleges.edu/fcwsrc/events,
Global Refugee Crisis: Why do we hate/fear those who suffer?,"Religion, History, Humanities, Diversity/Equity/Inclusion",Westfield State University,"Wed, Feb 22, 2017",,10:30am-1:00pm,"Westfield State University, Westfield, MA","Sami Aziz is the Muslim Chaplain at Wesleyan University. In addition to his work at Wesleyan, Sami serves as the Muslim Chaplain at Quinnipiac University and as the President of Common Ground Institute & Services http://www.CommonGroundServices.org.

Mr. Aziz has worked with and in over a dozen educational and service-based organizations in the American Muslim Community over the last decade. Sami is a public lecturer on Islam, Interfaith work, Muslim culture, and various other topics. He travels regularly to different communities across the New England to speak and organize events. Sami spends his free time commenting on popular culture, playing basketball, reading news, and adventuring his way through nature.

If you need to request an accommodation for a disability including sign interpretation, please contact Event Management directly at (413) 572-8276.",http://www.westfield.ma.edu/events/view/global-refugee-crisis-why-do-we-hate-fear-those-who-suffer,
A Night with Artist Rico Gatson,Arts,Amherst College and Mead Art Museum,"Thu, Feb 23, 2017",,5:00 PM,"Mead Art Museum, Amherst, MA","Join Rico Gatson in this evening event celebrating his Hall Walls mural, a project completed with the collaboration of Five College students.",https://www.amherst.edu/news/calendar/node/671900,
"Michael Ching Speaks on ""Apollonian Circle Packings""","Math, STEM",Amherst College,"Thu, Feb 23, 2017",,4:30pm-5:30pm,"Amherst College, Amherst, MA","A few years ago, Michael Ching, assistant professor at Amherst College, had a student, Sunny Xiao '14, who wrote her thesis on what are called ""Apollonian Circle Packings."" In this talk, Ching will explain Xiao's work and describe some problems in this area that are still unsolved.

Professor Ching writes that ""to make an Apollonian Circle Packing you start with three mutually tangent circles in a plane and add those new circles that are tangent to all three. Then you add new circles tangent to three you already have and repeat forever. The resulting collection of circles forms a beautiful fractal-like picture. But what sorts of pictures are possible? How much of the plane gets covered by the resulting circles? And how do the answers depend on which three circles you started with? Sunny discovered new circle packings with extra symmetry that increased our understanding of these issues, but there is still a lot to be worked out.""",https://www.amherst.edu/news/calendar/node/675784,
The Five College Student Film and Video Festival ,"Arts, Film, Theater",Five College Consortium,"Fri, Feb 24, 2017",,7:00-9:00pm,"Smith College, Northampton, MA","The Five College Student Film and Video Festival is an annual event featuring original films and videos by Five College students. Founded in 1994, the festival has become an important venue for film students to meet, collaborate and share their productions with their peers and with the Five College film community.

Students from each of the Five Colleges organize the festival with the assistance of a Student Director from the host college and a faculty advisor. The festival, which is sponsored by the Five College Film Council, is held each year during the Spring semester. Submissions are evaluated by a jury of students and faculty members from each campus. Selected works are shown at the festival and awards are given.

From among the pool of films and videos selected to screen at the festival, 10 will be awarded prizes. This year, these 10 prizes for outstanding work will be given titles based on jury evaluation (i.e. ""most outstanding ____""), written reasons for their selection, and one will be named best of festival! There will also be a new audience choice award.",https://www.fivecolleges.edu/calendar-of-events/listings/node/161241,
Peace and Human Rights for Afro-Colombian and Indigenous Peoples in Colombia,"History, Humanities, Global Studies",Amherst College Political Science Department,"Fri, Feb 24, 2017",,3:00pm-4:30pm,"Amherst College, Amherst, MA","Marino Cordoba and Gimena Sanchez-Garzoli will give a talk titled ""Peace and Human Rights for Afro-Colombian and Indigenous Peoples in Colombia"" with an introduction by Congressman James McGovern. Marino Cordoba is from the Association for Internally Displaced Afro-Colombians and is the international coordinator for the Ethnic Commission for Peace and Territorial Rights. Gimena Sanchez-Garzoli is from the Washington Office on Latin America. This event is free and open to the public and is sponsored by the Political Science Department at Amherst College.",https://www.amherst.edu/news/calendar/node/675840,
Healing Through Art: One Veteran’s Story,"Arts, Counseling, History, Humanities, English, Global Studies, Social Justice",Greenfield Community College and Warrior Writers,"Mon, Feb 27, 2017",,12:00-1:00pm,"Greenfield Community College, Greenfield, MA","Join us for a conversation with artist and veteran Joe Merritt. Mr. Merritt was a machine gunner in the Marine Corps from 2006-2016. After returning from a deployment to Afghanistan he was diagnosed with depression and PTSD. It took a few years, the end of a marriage, and the responsibility of being a single parent to get him to admit he was struggling and seek help.

Mr. Merritt shares his experience working with the non-profit organization Warrior Writers, and talks about how finding the connections and answers we all share together—regardless of personal experience—is one piece, if not the missing piece of reintegration and success in the journey post-war.",http://www.gcc.mass.edu/events/healing-through-art-one-veterans-story/,
"New Perspectives in American Music: “You Are My Dwelling Place”, a Talk by Dr. Alisha Jones","Music, Arts, Religion",Amherst College,"Mon, Feb 27, 2017",,4:30 PM,"Amherst College, Amherst, MA","Dr. Alisha Jones, assistant professor of ethnomusicology, Department of Folklore and Ethnomusicology Indiana University, Bloomington, considers gospel music as an embodied sexual activity in which vocalists simultaneously experience and surrogate pleasure as an essential, unspoken feature of worship leadership.

Dr. Jones presents her talk “You Are My Dwelling Place: Experiencing Black Male Vocalists’ Worship as Autoeroticism in Gospel Performance"" as part of the Amherst Music Department speaker series, New Perspectives in American Music.

Free and open to the public.",https://www.amherst.edu/academiclife/departments/music/events/node/673927,
"The History of Black Tennis, the History of the Carrington Tennis Academy, and the Process of Archiving it all","History, Humanities, Diversity/Equity/Inclusion, English",Hampshire College,"Tue, Feb 28, 2017",,5:00pm-6:30pm,"Hampshire College, Amherst, MA","Art Carrington learned his skills in one of the first private Black tennis clubs, mentored by a strata of educated black professionals dedicated to the promotion of tennis as a social sport. He was a frequent practice partner of Arthur Ashe and assisted him in numerous tennis events. The Carrington Tennis Academy has been in operation for over 30 years, and offers classes at the Bay Road Indoor Tennis Courts right here at Hampshire College. 
Art will talk about some of the many books and authors that have inspired and influenced him along the way. 

There will be food! And plenty of time for questions.",https://intranet.hampshire.edu/calendar/thyme/index.php?event_action=view&eid=122407&instance=2017-2-28,
Mapping Sexuality in Ancient Rome - a talk by Dr. Luca Grillo,"Humanities, History, English",Amherst College,"Tue, Feb 28, 2017",,7:30pm-9:00pm,"Amherst College, Amherst, MA","On Tuesday, February 28 at 7:30 p.m. in the Merrill Science Building, Merrill 4, Dr. Luca Grillo will be giving a talk titled ""Mapping Sexuality in Ancient Rome"". Dr. Grillo asks ""How did the ancient Romans conceive sex and sexuality? Did they have the same categories we can easily take for granted today? Could sexual inclinations elicit admiration, disparagement or disapproval? This talk will address these and similar questions by locating Roman habits in their historical and cultural context and by discussing formalist and constructivists approaches.

Luca Grillo is an associate professor of classics and William R. Kenan Scholar at the University of North Carolina, Chapel Hill, after earning his M.A.s from the University of Minnesota (classical and near eastern studies), a PhD from Princeton (classics) and after teaching for five years at Amherst College (2008-13). His area of specialty is Latin prose and Roman history, with a special focus on writers of the Late Republic. He is co-editor of the forthcoming Cambridge Companion to Caesar and he published a monograph on Caesar’s Civil War, a commentary on an oration by Cicero, and various articles.

This event is being sponsored by the Lamont Funds and by the political science department of Amherst College. It is free and open to the public.",https://www.amherst.edu/news/calendar/node/675119,
"Joe Tranquillo, Bucknell: ""Engineering as a Liberal Art?""","Science, Math, STEM, Humanities",Amherst College,"Tue, Feb 28, 2017",,4:45pm-6:00pm,"Amherst College, Amherst, MA","Engineering is the practical discipline that brought us the wheel, printing press, steam engine and smartphone. The building of tools has always been a hallmark of our species, and technology has become an important driver of social change. But what is it to be an engineer? In what ways are the stereotypes of engineers an outdated 1950's caricature? In this talk we will focus on who engineers are becoming by highlighting projects at the intersection between technology and the liberal arts. These will include projects on landmine detecting rats, biomusical instruments, the re-creation of historical scientific instruments, and the design of medical devices. The talk will conclude with some ideas on where technology might take us next.",https://www.amherst.edu/academiclife/departments/physics/seminars_and_colloquia/node/652288,
A Dialogue with Beverly Daniel Tatum on Creating Inclusive Classrooms at Smith College,"Diversity/Equity/Inclusion, Counseling, Leadership, Gender Studies, Social Justice",Smith College,"Wed, Mar 1, 2017",,4:30-6:00pm,"Smith College, Northampton, MA","Dr. Beverly Daniel Tatum is a scholar, teacher, author, and race-relations expert. Before becoming a Smith College trustee, Dr. Tatum earned her Ph.D. in Clinical Psychology and M.A. in Religious Studies, taught psychology at Mount Holyoke College, and led Spelman College as its ninth president.

The Director of the Sherrerd Center for Teaching and Learning will draw from questions submitted by members of the Smith College community to facilitate an on-stage conversation with Dr. Tatum about creating inclusive classrooms.

The Sherrerd Center for Teaching and Learning is pleased to cosponsor these events with the Office of the President, the Office of the Provost, and the Office of Inclusion, Equity, and Diversity.

Please contact the Sherrerd Center at sherrerdcenter@smith.edu if you have questions.",https://www.fivecolleges.edu/calendar-of-events/listings/node/162418,X
"Trans* Speaker Series: An Evening with Talia Bettcher - ""The Phenomenology of Illusion: On Gender Transitions and Existential Identity""","Diversity/Equity/Inclusion, Gender Studies, Humanities, Social Justice",Umass Amherst,"Wed, Mar 1, 2017",,5:00 PM,"Umass Amherst, Amherst, MA","Talia Mae Bettcher, Ph.D. is a professor of philosophy at California State University, Los Angeles. She has published articles on transphobia and transphobic violence and she teaches courses on the philosophy of gender, including “Introduction to Transgender Studies” and “Trans/Feminism.” She is the past eirector of the Center for Study of Genders and Sexualities at CSULA and is currently department chair. She is also a community-based performance artist and she has been actively involved in Los Angeles transgender community and grass-roots organizing for many years.
Organized by the Department of Women, Gender and Sexuality Studies with support from the College of Humanities and Fine Arts and the Provost's Office.",http://www.umass.edu/events/trans-speaker-series-evening,
Buddhism in Current China - lecture by The Venerable Yifa,"Religion, History, Humanities","Hampshire College, Smith College, Amherst College","Wed, Mar 1, 2017",,5:00pm-7:00pm,"Hampshire College, Amherst, MA","As the founder of the Woodenfish Project in 2002 which moved from Taiwan to mainland China in 2009, the Ven. Yifa has been a first-hand witness of many changes and revivals within the Buddhist community in China. In her lecture, the Ven. Yifa will share her reflections on the phenomena of Buddhist rejuvenation in current China. During the first phase in the 1980's after China's Cultural Revolution, Buddhist leaders derived policies to revive Buddhism. During the second phase, after the thirty years of Deng Xiaoping's economic reforms, reconstruction of giant temples and monasteries on historical sites mushroomed around the country. Under the surface of massive temple reconstruction, we find struggles sparking between the monastic communities that want to uphold cultural traditions, local governments seeking revenue from entrance fees, and investing developers craving monetary profits from temple tourism. The rule and management of sacred temples are in the hands of investors who plan to put the temples to IPO (initial public offering), but some are stopped by the central government's decrees. As we now enter the third phase, the Chinese Buddhist community faces a challenge of cultivating a new generation of more talented monastics to fill the new, massive temples by promoting seminary education and facilitating more modern internet media and propagation of Buddhist dharma. 

The ven. Dr. Yifa is abbess of Woodenfish Foundation (Beijing), a lawyer and a scholar of philosophy and religious studies. She is a leader in interreligious dialogue, Buddhist education and in advocacy for women's health and women's rights. Her work has been central to the development of Buddhist political, educational and charitable work in East Asia. 

~~~
Over the course of 2016-17, the Robed Warriors program brings to the Five Colleges four prominent Buddhist monastic women whose work has transformed contemporary Buddhist practice and the world beyond. Each visiting scholar is in residence for one to two weeks, with Smith College as the home base.",https://intranet.hampshire.edu/calendar/thyme/index.php?event_action=view&eid=123158&instance=2017-3-1,
"Showing of the documentary film ""Sonic Sea,"" followed by Q&A",Science,Hampshire College and Five College Coastal and Marine Sciences Program,"Wed, Mar 1, 2017",,6:30pm-8:30pm,"Hampshire College, Amherst, MA","A showing of the documentary film ""Sonic Sea. The film is a documentary about the effects of noise on marine life (more information is at sonicsea.org). 

The film runs for one hour, and will be followed by a question and answer session with guest Leila Hatch, Marine Ecologist at the Stellwagen Bank National Marine Sanctuary (who is featured in the film) and Laela Sayigh, Hampshire College Visiting Assistant Professor of Animal Behavior and Woods Hole Oceanographic Institution Research Specialist.

This showing is co-sponsored by the Hampshire College CS-0259 Marine Mammals class taught by Laela Sayigh, and the Five College Coastal and Marine Sciences Program (contact person: Cindy Bright).",https://intranet.hampshire.edu/calendar/thyme/index.php?event_action=view&eid=123109&instance=2017-3-1,
