Name,Category,Organization,Date,End Date,Time,Location,Description,URL,Emily: 👍
Raptors Over the Range,Science,Skinner State Park,"Sat, Sep 30, 2017",,9:30-10:00am,"Skinner State Park, Hadley, MA","Raptors Over the Range: For adults and families with children ages 6 and older. With its relatively rare east-to-west orientation and vantage point overlooking the Pioneer Valley below, the Mount Holyoke Range features several spots that are ideal for viewing the fall migration of hawks and other raptors heading south. The deck of the Summit House is one such vantage point. Learn why the range is such a popular thoroughfare for raptors and how to identify the raptors you are seeing. Meet on the Summit House deck. If you wish to watch for hawks after the talk, it is recommended that you bring binoculars if you have them. A scope will be available for shared use.",http://valleyadvocate.com/events/#!/details/Raptors-Over-the-Range/3854234/2017-09-16T09,
"Mira Bartok, The Wonderling","Litearture, Humanities",The Odyssey Bookshop,"Sat, Sep 30, 2017",,4:00 PM,"South Hadley, MA","Welcome to the Home for Wayward and Misbegotten Creatures, an institution run by evil Miss Carbunkle, a cunning villainess who believes her terrified young charges exist only to serve and suffer. Part animal and part human, the groundlings toil in classroom and factory, forbidden to enjoy anything regular children have, most particularly singing and music. For the Wonderling, an innocent-hearted, one-eared, fox-like eleven-year-old with only a number rather than a proper name — a 13 etched on a medallion around his neck — it is the only home he has ever known. But unexpected courage leads him to acquire the loyalty of a young bird groundling named Trinket, who gives the Home’s loneliest inhabitant two incredible gifts: a real name — Arthur, like the good king in the old stories — and a best friend. Using Trinket’s ingenious invention, the pair escape over the wall and embark on an adventure that will take them out into the wider world and ultimately down the path of sweet Arthur’s true destiny. Richly imagined, with shimmering language, steampunk motifs, and gripping, magical plot twists, this high adventure fantasy is the debut novel of award-winning memoirist Mira Bartók and has already been put into development for a major motion picture.
 
Mira Bartók is an artist and writer, and the creator of The Wonderling: Songcatcher, the first book in an illustrated middle-grade fantasy series, forthcoming by Candlewick Press on September 26th, 2017. As luck would have it, The Wonderling will also be a movie, directed by award-winning British director, Stephen Daldry (The Crown, Billy Elliot, The Reader, etc.), and produced by Working Title Films and Fox2000. She is also the author of The Memory Palace, a New York Times bestselling memoir and winner of the National Book Critics Circle Award for autobiography. She has written numerous books on ancient and indigenous cultures for children (The Ancient and Living Stencil Series), and her writing for adults has been nominated for a Pushcart Prize, noted in The Best American Essays series and has appeared in many literary journals, magazines and anthologies. She lives in Western Massachusetts with her musician/producer husband Doug Plavin and their little bat-eared dog Sadie.
",http://www.odysseybks.com/event/mira-bartok-wonderling,
Raptors Over the Range,Science,Skinner State Park,"Sun, Oct 1, 2017",,10:30-11:00am,"Skinner State Park, Hadley, MA","Raptors Over the Range: For adults and families with children ages 6 and older. With its relatively rare east-to-west orientation and vantage point overlooking the Pioneer Valley below, the Mount Holyoke Range features several spots that are ideal for viewing the fall migration of hawks and other raptors heading south. The deck of the Summit House is one such vantage point. Learn why the range is such a popular thoroughfare for raptors and how to identify the raptors you are seeing. Meet on the Summit House deck. If you wish to watch for hawks after the talk, it is recommended that you bring binoculars if you have them. A scope will be available for shared use.",http://valleyadvocate.com/events/#!/details/Raptors-Over-the-Range/3854234/2017-09-16T09,
Making the Connecticut River Valley,"History, Science",The Notch Visitors Center,"Sun, Oct 1, 2017",,9:30-10:00am,"The Notch Visitors Center, Amherst, MA","Travel through geologic time as we see our home transform between ocean, tall mountains, lava oozes, and burial under thick layers of ice.

The talk will end with trail recommendations for exploring the geology on your own.

Meet at the picnic table behind the kiosk. In case of rain, meet in Visitors Center.

For adults and families with children ages 10 and older.
",http://valleyadvocate.com/events/#!/details/-Making-the-Connecticut-River-Valley-/3857581/2017-09-23T09,
Lecture: 'The Power of Active Bystanders',"Social Justice, History, Humanities, Diversity/Equity/Inclusion",Umass Amherst,"Mon, Oct 2, 2017",,12:00-1:30pm,"Umass Amherst, Amherst, MA","What are the roots of active bystandership—actions to help, prevent harm, promote the welfare of individuals and groups—and what inhibits people from being active bystanders? Dr. Staub will describe research, theory, and examples of interventions to prevent harmful behavior/violence and generate positive action. He will show how passivity encourages and empowers harmful actions and can allow the evolution of extreme harm. He will also highlight the power of individuals (and groups) to prevent harm and generate positive evolution. Among the examples will be genocide and rescuers; interventions in Rwanda, Burundi, and the Congo to promote reconciliation; and in Amsterdam following violence to improve Dutch-Muslim relations; training of police to be active bystanders who prevent or stop unnecessary harm by fellow officers; and training of students in schools to inhibit bullying. He will also briefly discuss the socialization of children to become caring, helpful, active bystanders.  In the end he will discuss application to the current situation in the U.S.",http://www.umass.edu/events/lecture-power-active,
Lecture: 'Acoustics in the Design Building',"Arts, Architecture, Math, STEM",Umass Amherst,"Mon, Oct 2, 2017",,4:00-5:00pm,"Umass Amherst, Amherst, MA","Learn how acoustically comfortable space is achieved in the face of multiple obstacles with speaker Rose Mary Su, senior consultant at ACENTECH.
Acoustics is the key to success for many buildings and building spaces. Most of us have dined in a noisy restaurant unable to hear our friend sitting across the table, or tried to study in a library full of distracting noises. Workplaces today tend to be open and collaborative, but the noise level may inhibit productivity. 
Presented by the building and construction technology program. ",http://www.umass.edu/events/lecture-acoustics-design,
"The power of active bystanders: Genocide, reconciliation, police behavior, children and bullying, and Trumpworld","Science, Social Justice, Humanities, Global Studies, Diversity/Equity/Inclusion",Umass Amherst,"Mon, Oct 2, 2017",,12:00 PM,"Umass Amherst, Amherst, MA","Seminar - Psychological and Brain Sciences Department, Psychology of Peace and Violence

with Ervin Staub, PhD, Psychological and Brain Sciences",https://www.cns.umass.edu/news-events/events/2017-10-02-power-active-bystanders-genocide-reconciliation-police-behavior,
"Truth to Power: Writers Respond To The Rhetoric Of Hate And Fear - A Reading with Doug Anderson, Chard deNiord, Martín Espada, Howie Faerstein, Leslie McGrath, & Lauren Marie Schmidt","Featured, Literature, History, Humanities, Social Justice, Diversity/Equity/Inclusion, Arts",The Odyssey Bookshop,"Mon, Oct 2, 2017",,7:00 PM,"South Hadley, MA","A Reading with Doug Anderson, Chard deNiord, Martín Espada, Howie Faerstein, Leslie McGrath, & Lauren Marie Schmidt

See author bios on website. 

Cutthroat, A Journal of the Arts announces the publication of a special collection of poetry, fiction and nonfiction, meant to address the rise in the public rhetoric of hatred and fear prompted by the 2016 presidential campaign and election.  Writers from diverse cultures, genders, ethnic backgrounds and races from all over the U.S. respond in poetry, fiction and nonfiction to social issues ranging from immigration, LGBT rights, women's rights, rights for people with disabilities, African American rights, Indigenous American Rights and Latino rights, poverty, inequality, the attack on our natural environment and more.
 
*Truth to Power: Writers Respond To The Rhetoric of Hate And Fear will be on sale at the event for $20.00. The publisher will donate profits to the ACLU, the Standing Rock Sioux, and the Southern Poverty Law Center. ",http://www.odysseybks.com/event/truth-power-writers-respond-rhetoric-hate-and-fear,
"Robert Musil: ""Is Anybody Listening? Lessons from a Life in Advocacy"" ","Science, Sustainability, Social Justice, Diversity/Equity/Inclusion, Gender Studies, Humanities, History",Mount Holyoke College,"Tue, Oct 3, 2017",,4:30-6:00pm,"Mount Holyoke College, South Hadley, MA","From the Vietnam anti-war movement, to award-winning alternative radio, to today’s campaigns to link the environment with economic, gender, and racial justice, Rachel Carson Council CEO Robert Musil will share his insights on effective organizing, communications, and lobbying at a public lecture “Is Anybody Listening? Lessons from a Life in Advocacy”. The event is free and open to the public. Wheelchair accessible, and closed caption. Part of the Weissman Center for Leadership series on Advocacy and the Public Domain.

This event precedes Musil’s lecture “The Rachel Carson Legacy: Empathy and Environmental Justice” on October 5 at 4:30 pm in Gamble Auditorium, sponsored by the Miller Worley Center for the Environment. ","https://events.mtholyoke.edu/MasterCalendar/EventDetails.aspx?EventDetailId=45676
",
"Plants of Pompeii, Ancient and Modern Medicinal Plants.","Science, Arts",Smith College,"Tue, Oct 3, 2017",,12:00-1:00pm,"Smith College, Northampton, MA","Plants of Pompeii With Artist Victoria I
Victoria I entered the world of ancient Rome by collaborating with Bettina Bergmann, professor at Mount Holyoke College, on reconstructing Roman domestic architecture.  One of her models — of the House of the Golden Bracelet — is on display in our exhibition, Plants of Pompeii, Ancient and Modern Medicinal Plants.
She met Wilhelmina Jashemski and began working with her on reconstructions of Pompeian gardens and eventually took on the project of completing the botanical illustrations for A Pompeian Herbal, which are shown in the exhibition.
In this gallery talk, Victoria I discusses her experiences working with Wilhelmina Jashemski as well as the process of creating the illustrations, working with botanist Frederick Meyer at the U. S. National Arboretum and botanist Massimo Riccardi in Naples.",https://www.smith.edu/about-smith/new-calendar?trumbaEmbed=view%3Devent%26eventid%3D259282438,
The Beatles: Band of the Sixties,"History, Humanities, Arts, Music",The Jones Library,"Tue, Oct 3, 2017",,7:00-8:30pm,"The Jones Library, Amherst, MA","Explore the music of the Beatles in this 60-minute multimedia presentation (part history and part musical analysis) spanning the full 1960's: beginning with the band's seminal visits to Hamburg, continuing through Beatlemania, and concluding with Abbey Road. The program, presented by Beatles scholar Aaron Krerowicz, will be supplemented with audio clips of music and excerpts from interviews with the band members. 

About the speaker: 
Professional Beatles scholar Aaron Krerowicz won a research grant through the University of Hartford in 2011 to study the band and since has presented his findings through more than 300 presentations throughout the US and England. He has authored four Beatles books, and created a series of original Beatles drawings. Aaron also produces a series of 60-second videos called The Beatles Minute, which can be found on his website and YouTube. For more information, and to register for his free monthly email newsletter, visit his website: www.AaronKrerowicz.com.

This program is made possible due to support and funding from the Friends of the Jones Libraries and the Woodbury Fund.",https://www.joneslibrary.org/Calendar.aspx?EID=3820&month=10&year=2017&day=3&calType=0,
Best Practices to Ensure Excellence and Diversity in Faculty Searches,"School Design, Leadership, Diversity/Equity/Inclusion",Umass Amherst,"Tue, Oct 3, 2017",,1:00-2:00pm,"Umass Amherst, Amherst, MA","presented by Buju Dasgupta, CNS Director of Faculty Equity and Inclusion",https://www.cns.umass.edu/news-events/events/2017-10-03-best-practices-ensure-excellence-and-diversity-faculty-searches,
Molecular and Cellular Biology Seminar: Visualization of transcription dynamics in living Drosophila embryos,Science,Umass Amherst,"Tue, Oct 3, 2017",,4:00 PM,"Umass Amherst, Amherst, MA","Mike Levine, Princeton Univeristy",https://www.cns.umass.edu/news-events/events?page=4,
Community Class: Shakespeare with Dr. Marie Roche,"Litearture, Arts, Humanities, Theater",Umass Amherst,"Tue, Oct 3, 2017",,5:00-6:30pm,"Umass Amherst, Amherst, MA","Tuesdays 5-6:30 PM in the upstairs classroom of the Arthur F. Kinney Center for Interdisciplinary Renaissance Studies.  This series runs Tuesdays for 9 weeks.  The first evening, Dr. Roche will review King John and Richard II and summarize important points discussed last semester.  All are welcome.  

Please register by October 2nd",http://www.umass.edu/english/event/community-class-shakespeare-dr-marie-roche,
"Lecture: 'Native New England: Resistance, Reclamation, Revitalization'","Social Justice, History, Humanities, Diversity/Equity/Inclusion, Global Studies",Umass Amherst,"Wed, Oct 4, 2017",,4:00-6:00pm,"Umass Amherst, Amherst, MA","Abenaki scholar Lisa Brooks will discuss the history of Indigenous resistance and adaptation to colonialism in New England, from the “First Indian War” (King Philip’s War, 1675-78) and 18th century Wabanaki dam protests to contemporary struggles to retain and protect sovereignty and sustenance.

Native leaders, artists and activists have used a variety of innovative tools toward reclamation and revitalization, including technologies like writing, filmmaking, and unexpected digital forms. She will discuss the ways in which environmental and social justice are often intertwined and lay the groundwork for imagining alternative futures through the renewal of relationships of alliance and reciprocity.

Brooks is associate professor of English and American studies at Amherst College. Her first book, The Common Pot: The Recovery of Native Space in the Northeast, reframes the historical and literary landscape of the northeast, and received the Media Ecology Association's Dorothy Lee Award for Outstanding Scholarship in the Ecology of Culture in 2011. Although deeply rooted in her Abenaki homeland, Brooks’s work has been widely influential in a global network of scholars. She served on the inaugural Council of the Native American and Indigenous Studies Association (NAISA), and currently serves on the editorial boards of SAIL and Ethnohistory. She also works on the advisory board of Gedakina, a non-profit organization focused on Indigenous cultural revitalization, traditional ecological knowledge, and community wellness in New England. Her second book, Our Beloved Kin: A New History of King Philip’s War is forthcoming from Yale University Press (January 2018).

The lecture is part of the Resistance Studies Initiative Fall Speaker Series, in which  distinguished researchers and activists share critical reflections on resistance issues.

Refreshments will be served.",http://www.umass.edu/events/lecture-native-new-england,
Trip Advisor: Tech Talk,"Math, STEM, Science",Umass Amherst,"Wed, Oct 4, 2017",,5:30-7:00pm,"Umass Amherst, Amherst, MA","Engineers from TripAdvisor, the world's largest travel site, will be here at UMass to lead a Tech Talk. Don't miss it! More details to come.",https://www.cics.umass.edu/event/tripadvisor-tech-talk,
Can Adult House Flies Serve as a Vector for the ORF Disease of Sheep and Goats?,Science,Umass Amherst,"Wed, Oct 4, 2017",,4:00 PM,"Umass Amherst, Amherst, MA","John Stoffolano, Ph.D., UMass Amherst",https://www.cns.umass.edu/news-events/events/2017-10-04-can-adult-house-flies-serve-vector-orf-disease-sheep-and-goats,
Neuroscience and Behavior Seminar: Understanding the molecular components of a memory,Science,Umass Amherst,"Wed, Oct 4, 2017",,4:00 PM,"Umass Amherst, Amherst, MA",,https://www.cns.umass.edu/news-events/events/2017-10-04-understanding-molecular-components-memory,
"Native New England: Resistance, Reclamation, Revitalization","History, Humanities, Social Justice",Umass Amherst,"Wed, Oct 4, 2017",,4:00-6:00pm,"Umass Amherst, Amherst, MA","Lisa Brooks is Associate Professor of English and American Studies at Amherst College. Her first book, The Common Pot: The Recovery of Native Space in the Northeast, reframes the historical and literary landscape of the northeast, and received the Media Ecology Association's Dorothy Lee Award for Outstanding Scholarship in the Ecology of Culture in 2011. Although deeply rooted in her Abenaki homeland, Brooks’s work has been widely influential in a global network of scholars. She served on the inaugural Council of the Native American and Indigenous Studies Association (NAISA), and currently serves on the Editorial Boards of SAIL and Ethnohistory. She also works on the Advisory Board of Gedakina, a non-profit organization focused on Indigenous cultural revitalization, traditional ecological knowledge, and community wellness in New England. Her second book, Our Beloved Kin: A New History of King Philip’s War is forthcoming from Yale University Press (January 2018).

Abenaki scholar Lisa Brooks will discuss the history of Indigenous resistance and adaptation to colonialism in New England, from the “First Indian War” (King Philip’s War, 1675-1678) and eighteenth-century Wabanaki dam protests to contemporary struggles to retain and protect sovereignty and sustenance. Native leaders, artists and activists have used a variety of innovative tools toward reclamation and revitalization, including technologies like writing, filmmaking, and unexpected digital forms. She will discuss the ways in which environmental and social justice are often intertwined and lay the groundwork for imagining alternative futures through the renewal of relationships of alliance and reciprocity.",https://www.cns.umass.edu/news-events/events/2017-10-04-lisa-brooks-native-new-england-resistance-reclamation-revitalization,
Panel discussion: Is America Becoming a Fascist State?,"History, Humanities, Social Justice",Umass Amherst,"Wed, Oct 4, 2017",,4:00 PM,"Umass Amherst, Amherst, MA","The University Union sponsors a panel on ""Is America Becoming A Fascist State?""

Visiting scholar Peter Baehr will speak to the question. Then three UMass Amherst faculty members will respond.  The respondents are Bruce Laurie and Laura Lovett from the history department, and Toussaint Losier from Afro-American studies. Questions and comments from the audience will follow.

The University Union is a Registered Student Organization that organizes panels and debates on vital issues of our times.",http://www.umass.edu/history/event/university-union-panel-discussion-america-becoming-fascist-state,
Robert K. Musil: “The Legacy of Rachel Carson: Empathy and Environmental Justice”,"Science, Sustainability, Social Justice, Diversity/Equity/Inclusion, Gender Studies, Humanities, History","Mount Holyoke College, Odyssey Bookshop","Thu, Oct 5, 2017",,4:30-6:00pm,"Mount Holyoke College, South Hadley, MA","Please join us in welcoming Robert K. Musil, President and CEO of the Rachel Carson Council, as he discusses environmental justice and political advocacy. There will be a book signing after a presentation. This event is free and open to the public.

Sponsored by Miller Worley Center for the Environment, Weissman Center for Leadership, Department of Environmental Studies, The Science Center and supported by the Council of Independent Colleges Woodrow Wilson Scholars program.

Robert K. Musil PhD, MPH
In addition to being president and CEO of the Rachel Carson Council, Robert Musil is also a senior fellow and adjunct professor at the Center for Congressional and Presidential Studies, School of Public Affairs, American University.

Musil specializes in contemporary global sustainability, security, and health issues, as well as Cold War history, culture, and policy.

He is the author of numerous articles and ""Rachel Carson and Her Sisters: Extraordinary Women Who Have Shaped America’s Environment"" (Rutgers Press, 2014) and ""Washington in Spring: A Nature Journal for a Changing Planet"" (Bartleby Press, 2016).",https://www.mtholyoke.edu/events/67690/robert-k-musil-legacy-rachel-carson-empathy-and-environmental-justice?_ga=2.31113913.728589323.1505241219-2103018882.1499533833,
"Word by Word: the Secret Life of Dictionaries,""","Literature, History, Humanities",Smith College,"Thu, Oct 5, 2017",,4:30-6:30pm,"Smith College, Northampton, MA","The author of ""Word by Word: the Secret Life of Dictionaries,"" Kory Stamper '96 will deliver this year's McGrath Lecture. Sponsored by the Mortimer Rare Book Collection and the Friends of the Smith College Libraries.",https://www.smith.edu/about-smith/new-calendar?trumbaEmbed=view%3Devent%26eventid%3D236592636,
"Green Building Tours with Ludmilla Pavlova, Senior Campus Planner","Science, Sustainability, Architecture, Social Justice, Arts, STEM",Umass Amherst,"Thu, Oct 5, 2017",,5:00-5:30pm,"Umass Amherst, Amherst, MA","Get the inside stories of the new Design Building, renovated Old Chapel, South College addition, Integrative Learning Center, and others.
Part of the UMass Amherst project, ""Talking Truth: Finding Your Voice around the Climate Crisis.""",,
"""Visualizing Abscence: Broken (hyper)LInks between Mary Wroth and Mary Sidney Herbert""","Literature, STEM, Humanities",Umass Amherst,"Thu, Oct 5, 2017",,4:00 PM,"Umass Amherst, Amherst, MA","Five College Renaissance Seminar: Amanda Henrichs

Lecture to be delivered by Amanda Henrichs, Five College Mellon Pestdoctoral Fellow in Digital Humanities.

This event is free and open to the public.",http://www.umass.edu/english/event/five-college-renaissance-seminar-amanda-henrichs,
"Rescued: What Second-Chance Dogs Teach Us about Living with Purpose, Loving with Abandon, and Finding Joy in the Little Things","Literature, Humanities",The Odyssey Bookshop,"Thu, Oct 5, 2017",,7:00 PM,"South Hadley, MA","In the follow-up to his New York Times bestseller Rescue Road, acclaimed journalist Peter Zheutlin offers a heartwarming and often humorous new look into the world of rescue dogs. Sharing lessons from his own experiences adopting Labs with large personalities as well as stories and advice from dozens of families and rescue advocates, Zheutlin reveals the surprising and inspiring life lessons rescue dogs can teach us, such as:
- How to ""walk a mile in a dog's paws"" to get a brand-new perspective
- Living with a dog is not one continuous Hallmark moment--but it's never dull
- Why having a dog helps you see your faults and quirks in a new light, even if you can't ""shed"" them completely
- How to set the world right, one dog at a time
For anyone who loves, lives with, or has ever wanted a dog, this charming book shows how the dogs whose lives we save can change ours for the better too.

Peter Zheutlin is a freelance journalist and bestselling author, whose work appears regularly in national publications, including The Boston Globe and The Christian Science Monitor. Zheutlin has also written for The LA Times, Parade Magazine, AARP Magazine and numerous other national newspapers and magazines. He is the author of the New York Times bestseller, Rescue Road: One Man, Thirty Thousand Dogs and a Million Miles on the Last Hope Highway, as well as one other book. He lives in Massachusetts with his wife, author Judith Gelman and two rescued Labradors.",http://www.odysseybks.com/event/peter-zheutlin-rescued,
The Living Future Institute’s Living Building Challenge,"Science, Sustainability, Architecture, STEM","Hitchcock Center for the Environment, Hampshire College","Thu, Oct 5, 2017",,7:30 PM,"Amherst, MA","The Hitchcock Center took the Living Building Challenge in building its new building. The Challenge is an innovative philosophy that asks us, “What does good look like?” What does it mean to build healthy homes and communities that are regenerative, socially and environmentally just? Come learn about the Challenge and how it can be a framework for influencing decisions we make in our daily lives.",http://www.hitchcockcenter.org/programs/community-programs/#sustainability,
